{"error_envelope_version":"trust-error-envelope-v1","schema_version":"trust-envelope-schema-v1","error_type":"money_source_not_authoritative","reason_code":"money_source_not_authoritative","tenant_id_hash":"sha256:aaaaaaaaaaaaaaaaaaaaaaaaaaaaaaaaaaaaaaaaaaaaaaaaaaaaaaaaaaaaaaaa","audience_binding":{"audience_mode":"tenant_internal","audience_id_hash":"sha256:bbbbbbbbbbbbbbbbbbbbbbbbbbbbbbbbbbbbbbbbbbbbbbbbbbbbbbbbbbbbbbbb","audience_scope":["trust.envelope.read"],"presentation_policy":"bearer_not_authority","replay_context_required":true},"created_at":"2026-06-24T10:00:02Z","audit_ref":"urn:skeldir:audit:money_source_not_authoritative","audit_hash":"sha256:aaaaaaaaaaaaaaaaaaaaaaaaaaaaaaaaaaaaaaaaaaaaaaaaaaaaaaaaaaaaaab3"}
