{"error_envelope_version":"trust-error-envelope-v1","schema_version":"trust-envelope-schema-v1","error_type":"schema_version_unsupported","reason_code":"schema_version_unsupported","tenant_id_hash":"sha256:aaaaaaaaaaaaaaaaaaaaaaaaaaaaaaaaaaaaaaaaaaaaaaaaaaaaaaaaaaaaaaaa","audience_binding":{"audience_mode":"public_verification_only","audience_id_hash":"sha256:cdcdcdcdcdcdcdcdcdcdcdcdcdcdcdcdcdcdcdcdcdcdcdcdcdcdcdcdcdcdcdcd","audience_scope":["trust.envelope.verify"],"presentation_policy":"verification_only","replay_context_required":false},"created_at":"2026-06-24T10:00:02Z","audit_ref":"urn:skeldir:audit:schema_version_unsupported","audit_hash":"sha256:aaaaaaaaaaaaaaaaaaaaaaaaaaaaaaaaaaaaaaaaaaaaaaaaaaaaaaaaaaaaaaad"}
